	episode_key	title	season	sequence_in_season	air_date	title_upper	title_camel	johanw	rank_webvectors_gigaword29	matched_tokens_count_webvectors_gigaword29	unmatched_tokens_count_webvectors_gigaword29	matched_tokens_webvectors_gigaword29	unmatched_tokens_webvectors_gigaword29	score_webvectors_gigaword29	rank_webvectors_enwiki223	matched_tokens_count_webvectors_enwiki223	unmatched_tokens_count_webvectors_enwiki223	matched_tokens_webvectors_enwiki223	unmatched_tokens_webvectors_enwiki223	score_webvectors_enwiki223	rank_glove_6B300d	matched_tokens_count_glove_6B300d	unmatched_tokens_count_glove_6B300d	matched_tokens_glove_6B300d	unmatched_tokens_glove_6B300d	score_glove_6B300d	rank_glove_twitter27B200d	matched_tokens_count_glove_twitter27B200d	unmatched_tokens_count_glove_twitter27B200d	matched_tokens_glove_twitter27B200d	unmatched_tokens_glove_twitter27B200d	score_glove_twitter27B200d	rank_glove_twitter27B100d	matched_tokens_count_glove_twitter27B100d	unmatched_tokens_count_glove_twitter27B100d	matched_tokens_glove_twitter27B100d	unmatched_tokens_glove_twitter27B100d	score_glove_twitter27B100d	rank_glove_42B300d	matched_tokens_count_glove_42B300d	unmatched_tokens_count_glove_42B300d	matched_tokens_glove_42B300d	unmatched_tokens_glove_42B300d	score_glove_42B300d	rank_glove_840B300d	matched_tokens_count_glove_840B300d	unmatched_tokens_count_glove_840B300d	matched_tokens_glove_840B300d	unmatched_tokens_glove_840B300d	score_glove_840B300d	rank_fasttext_wikinews300d1M	matched_tokens_count_fasttext_wikinews300d1M	unmatched_tokens_count_fasttext_wikinews300d1M	matched_tokens_fasttext_wikinews300d1M	unmatched_tokens_fasttext_wikinews300d1M	score_fasttext_wikinews300d1M	rank_fasttext_crawl300d2M	matched_tokens_count_fasttext_crawl300d2M	unmatched_tokens_count_fasttext_crawl300d2M	matched_tokens_fasttext_crawl300d2M	unmatched_tokens_fasttext_crawl300d2M	score_fasttext_crawl300d2M	rank_openai_ada002	matched_tokens_count_openai_ada002	unmatched_tokens_count_openai_ada002	score_openai_ada002
0	101	Encounter at Farpoint	1	1	1987-09-26 0:00:00	ENCOUNTER AT FARPOINT	Encounter At Farpoint	 Pilot episode for the series. While en route to investigate problems on Farpoint station, the Enterprise meets the mysterious super-powered Q. Q condemns humanity and challenges them to solve the mystery at Farpoint.  	30	10	12	pilot_NOUN, episode_NOUN, series_NOUN, station_NOUN, enterprise_NOUN, mysterious_ADJ, super_NOUN, humanity_NOUN, solve_VERB, mystery_NOUN	en_ADP, route_ADJ, investigate_NOUN, problems_NOUN, farpoint_VERB, meets_VERB, powered_VERB, q_ADJ, q_NOUN, condemns_NOUN, challenges_VERB, farpoint_NOUN	85.32289	68	15	7	pilot_NOUN, episode_NOUN, series_NOUN, route_ADJ, investigate_NOUN, problems_NOUN, station_NOUN, enterprise_NOUN, meets_VERB, mysterious_ADJ, super_NOUN, powered_VERB, humanity_NOUN, solve_VERB, mystery_NOUN	en_ADP, farpoint_VERB, q_ADJ, q_NOUN, condemns_NOUN, challenges_VERB, farpoint_NOUN	85.62814	12	22	0	pilot, episode, series, en, route, investigate, problems, farpoint, station, enterprise, meets, mysterious, super, powered, q, q, condemns, humanity, challenges, solve, mystery, farpoint		82.710457	50	20	2	pilot, episode, series, en, route, investigate, problems, station, enterprise, meets, mysterious, super, powered, q, q, condemns, humanity, challenges, solve, mystery	farpoint, farpoint	91.889644	63	20	2	pilot, episode, series, en, route, investigate, problems, station, enterprise, meets, mysterious, super, powered, q, q, condemns, humanity, challenges, solve, mystery	farpoint, farpoint	92.606854	21	22	0	pilot, episode, series, en, route, investigate, problems, farpoint, station, enterprise, meets, mysterious, super, powered, q, q, condemns, humanity, challenges, solve, mystery, farpoint		92.43569000000001	28	22	0	pilot, episode, series, en, route, investigate, problems, farpoint, station, enterprise, meets, mysterious, super, powered, q, q, condemns, humanity, challenges, solve, mystery, farpoint		86.49032	45	20	2	pilot, episode, series, en, route, investigate, problems, station, enterprise, meets, mysterious, super, powered, q, q, condemns, humanity, challenges, solve, mystery	farpoint, farpoint	95.044374	57	20	2	pilot, episode, series, en, route, investigate, problems, station, enterprise, meets, mysterious, super, powered, q, q, condemns, humanity, challenges, solve, mystery	farpoint, farpoint	87.60247	1	42	0	93.271697
1	103	The Naked Now	1	2	1987-10-03 0:00:00	THE NAKED NOW	The Naked Now	" A sequel episode to ""The Naked Time"" episode of the old series. The Enterprise rendezvouses with the science vessel U.S.S. Tsiolkovsky and find the entire crew dead. Unknowingly, they bring back to the Enterprise the strange infection that caused the crew of the science vessel to go crazy. The crew of the Enterprise discover that the cure found by the first Enterprise for this disease does not work due to a mutation in the virus.  "	63	33	8	sequel_NOUN, episode_NOUN, naked_ADJ, time_NOUN, episode_NOUN, old_ADJ, series_NOUN, enterprise_NOUN, science_NOUN, vessel_NOUN, find_NOUN, entire_ADJ, crew_NOUN, dead_ADJ, unknowingly_ADV, bring_VERB, enterprise_NOUN, strange_ADJ, infection_NOUN, science_NOUN, vessel_NOUN, go_VERB, crazy_ADJ, crew_NOUN, enterprise_NOUN, cure_NOUN, found_VERB, first_ADV, disease_NOUN, work_NOUN, due_ADJ, mutation_NOUN, virus_NOUN	rendezvouses_VERB, u_ADJ, tsiolkovsky_ADJ, back_PRT, caused_VERB, crew_ADJ, discover_NOUN, enterprise_ADJ	91.511524	24	36	5	sequel_NOUN, episode_NOUN, naked_ADJ, time_NOUN, episode_NOUN, old_ADJ, series_NOUN, enterprise_NOUN, science_NOUN, vessel_NOUN, find_NOUN, entire_ADJ, crew_NOUN, dead_ADJ, unknowingly_ADV, bring_VERB, enterprise_NOUN, strange_ADJ, infection_NOUN, crew_ADJ, science_NOUN, vessel_NOUN, go_VERB, crazy_ADJ, crew_NOUN, enterprise_NOUN, discover_NOUN, cure_NOUN, found_VERB, first_ADV, enterprise_ADJ, disease_NOUN, work_NOUN, due_ADJ, mutation_NOUN, virus_NOUN	rendezvouses_VERB, u_ADJ, tsiolkovsky_ADJ, back_PRT, caused_VERB	92.08262	18	40	1	sequel, episode, naked, time, episode, old, series, enterprise, science, vessel, u, tsiolkovsky, find, entire, crew, dead, unknowingly, bring, back, enterprise, strange, infection, caused, crew, science, vessel, go, crazy, crew, enterprise, discover, cure, found, first, enterprise, disease, work, due, mutation, virus	rendezvouses	91.87937000000001	22	39	2	sequel, episode, naked, time, episode, old, series, enterprise, science, vessel, u, find, entire, crew, dead, unknowingly, bring, back, enterprise, strange, infection, caused, crew, science, vessel, go, crazy, crew, enterprise, discover, cure, found, first, enterprise, disease, work, due, mutation, virus	rendezvouses, tsiolkovsky	97.27298	40	39	2	sequel, episode, naked, time, episode, old, series, enterprise, science, vessel, u, find, entire, crew, dead, unknowingly, bring, back, enterprise, strange, infection, caused, crew, science, vessel, go, crazy, crew, enterprise, discover, cure, found, first, enterprise, disease, work, due, mutation, virus	rendezvouses, tsiolkovsky	97.495186	14	40	1	sequel, episode, naked, time, episode, old, series, enterprise, science, vessel, u, tsiolkovsky, find, entire, crew, dead, unknowingly, bring, back, enterprise, strange, infection, caused, crew, science, vessel, go, crazy, crew, enterprise, discover, cure, found, first, enterprise, disease, work, due, mutation, virus	rendezvouses	97.274685	19	39	2	sequel, episode, naked, time, episode, old, series, enterprise, science, vessel, u, find, entire, crew, dead, unknowingly, bring, back, enterprise, strange, infection, caused, crew, science, vessel, go, crazy, crew, enterprise, discover, cure, found, first, enterprise, disease, work, due, mutation, virus	rendezvouses, tsiolkovsky	94.91781	22	39	2	sequel, episode, naked, time, episode, old, series, enterprise, science, vessel, u, find, entire, crew, dead, unknowingly, bring, back, enterprise, strange, infection, caused, crew, science, vessel, go, crazy, crew, enterprise, discover, cure, found, first, enterprise, disease, work, due, mutation, virus	rendezvouses, tsiolkovsky	97.286093	25	39	2	sequel, episode, naked, time, episode, old, series, enterprise, science, vessel, u, find, entire, crew, dead, unknowingly, bring, back, enterprise, strange, infection, caused, crew, science, vessel, go, crazy, crew, enterprise, discover, cure, found, first, enterprise, disease, work, due, mutation, virus	rendezvouses, tsiolkovsky	92.474467	1	93	0	91.95659
2	104	Code of Honor	1	3	1987-10-10 0:00:00	CODE OF HONOR	Code Of Honor	 The Enterprise travels to Ligon II to obtain a rare vaccine needed to avert a plague on another planet. The Logonian leader kidnaps Tasha as part of the traditions of his planet. Eventually she is forced to fight a battle to the death with the wife of the leader in order to gain her freedom and the vaccine.  	18	18	12	enterprise_NOUN, travels_NOUN, obtain_VERB, rare_ADJ, vaccine_NOUN, plague_NOUN, planet_NOUN, leader_NOUN, part_NOUN, eventually_ADV, battle_NOUN, death_NOUN, wife_NOUN, leader_NOUN, order_NOUN, gain_NOUN, freedom_NOUN, vaccine_NOUN	ligon_VERB, ii_ADJ, needed_VERB, avert_ADJ, another_DET, logonian_ADJ, kidnaps_NOUN, tasha_VERB, traditions_NOUN, planet_VERB, forced_VERB, fight_ADJ	89.47734	5	21	9	enterprise_NOUN, ii_ADJ, obtain_VERB, rare_ADJ, vaccine_NOUN, needed_VERB, plague_NOUN, planet_NOUN, leader_NOUN, part_NOUN, planet_VERB, eventually_ADV, fight_ADJ, battle_NOUN, death_NOUN, wife_NOUN, leader_NOUN, order_NOUN, gain_NOUN, freedom_NOUN, vaccine_NOUN	travels_NOUN, ligon_VERB, avert_ADJ, another_DET, logonian_ADJ, kidnaps_NOUN, tasha_VERB, traditions_NOUN, forced_VERB	90.34851	7	29	1	enterprise, travels, ligon, ii, obtain, rare, vaccine, needed, avert, plague, another, planet, leader, kidnaps, tasha, part, traditions, planet, eventually, forced, fight, battle, death, wife, leader, order, gain, freedom, vaccine	logonian	90.72403	11	29	1	enterprise, travels, ligon, ii, obtain, rare, vaccine, needed, avert, plague, another, planet, leader, kidnaps, tasha, part, traditions, planet, eventually, forced, fight, battle, death, wife, leader, order, gain, freedom, vaccine	logonian	95.96081	16	29	1	enterprise, travels, ligon, ii, obtain, rare, vaccine, needed, avert, plague, another, planet, leader, kidnaps, tasha, part, traditions, planet, eventually, forced, fight, battle, death, wife, leader, order, gain, freedom, vaccine	logonian	96.301794	7	29	1	enterprise, travels, ligon, ii, obtain, rare, vaccine, needed, avert, plague, another, planet, leader, kidnaps, tasha, part, traditions, planet, eventually, forced, fight, battle, death, wife, leader, order, gain, freedom, vaccine	logonian	96.19872600000001	8	29	1	enterprise, travels, ligon, ii, obtain, rare, vaccine, needed, avert, plague, another, planet, leader, kidnaps, tasha, part, traditions, planet, eventually, forced, fight, battle, death, wife, leader, order, gain, freedom, vaccine	logonian	93.15649	8	27	3	enterprise, travels, ii, obtain, rare, vaccine, needed, avert, plague, another, planet, leader, kidnaps, part, traditions, planet, eventually, forced, fight, battle, death, wife, leader, order, gain, freedom, vaccine	ligon, logonian, tasha	96.767926	10	28	2	enterprise, travels, ii, obtain, rare, vaccine, needed, avert, plague, another, planet, leader, kidnaps, tasha, part, traditions, planet, eventually, forced, fight, battle, death, wife, leader, order, gain, freedom, vaccine	ligon, logonian	91.51366	1	67	0	92.47216999999999
3	107	The Last Outpost	1	4	1987-10-17 0:00:00	THE LAST OUTPOST	The Last Outpost	 A Ferengi vessel steals an energy unit from a Federation base and the Enterprise pursues. Both ships are rendered immobile as they pass an unknown solar system. Believing each other responsible for the immobility, they discuss surrender. Meanwhile, an Enterprise probe discovers that a force-field on the nearby planet is actually responsible and a joint expedition of Ferengi and Federation personnel, beam down to explore. They encounter a mysterious being known as Portal who presents them a test.  	39	30	14	vessel_NOUN, energy_NOUN, unit_NOUN, federation_NOUN, base_NOUN, enterprise_NOUN, immobile_ADJ, pass_NOUN, solar_ADJ, system_NOUN, responsible_ADJ, immobility_NOUN, surrender_NOUN, meanwhile_ADV, enterprise_NOUN, probe_NOUN, force_VERB, field_NOUN, nearby_ADJ, planet_NOUN, actually_ADV, responsible_ADJ, joint_ADJ, expedition_NOUN, federation_NOUN, personnel_NOUN, beam_NOUN, mysterious_ADJ, portal_ADJ, test_NOUN	ferengi_ADJ, steals_NOUN, pursues_VERB, ships_NOUN, rendered_VERB, unknown_ADP, believing_VERB, discuss_NOUN, discovers_NOUN, ferengi_NOUN, explore_ADV, encounter_ADV, known_VERB, presents_NOUN	91.38577599999999	33	35	9	vessel_NOUN, energy_NOUN, unit_NOUN, federation_NOUN, base_NOUN, enterprise_NOUN, ships_NOUN, immobile_ADJ, pass_NOUN, solar_ADJ, system_NOUN, responsible_ADJ, immobility_NOUN, discuss_NOUN, surrender_NOUN, enterprise_NOUN, probe_NOUN, force_VERB, field_NOUN, nearby_ADJ, planet_NOUN, actually_ADV, responsible_ADJ, joint_ADJ, expedition_NOUN, federation_NOUN, personnel_NOUN, beam_NOUN, explore_ADV, encounter_ADV, mysterious_ADJ, known_VERB, portal_ADJ, presents_NOUN, test_NOUN	ferengi_ADJ, steals_NOUN, pursues_VERB, rendered_VERB, unknown_ADP, believing_VERB, meanwhile_ADV, discovers_NOUN, ferengi_NOUN	91.96392	6	44	0	ferengi, vessel, steals, energy, unit, federation, base, enterprise, pursues, ships, rendered, immobile, pass, unknown, solar, system, believing, responsible, immobility, discuss, surrender, meanwhile, enterprise, probe, discovers, force, field, nearby, planet, actually, responsible, joint, expedition, ferengi, federation, personnel, beam, explore, encounter, mysterious, known, portal, presents, test		90.712595	5	44	0	ferengi, vessel, steals, energy, unit, federation, base, enterprise, pursues, ships, rendered, immobile, pass, unknown, solar, system, believing, responsible, immobility, discuss, surrender, meanwhile, enterprise, probe, discovers, force, field, nearby, planet, actually, responsible, joint, expedition, ferengi, federation, personnel, beam, explore, encounter, mysterious, known, portal, presents, test		94.07216000000001	3	44	0	ferengi, vessel, steals, energy, unit, federation, base, enterprise, pursues, ships, rendered, immobile, pass, unknown, solar, system, believing, responsible, immobility, discuss, surrender, meanwhile, enterprise, probe, discovers, force, field, nearby, planet, actually, responsible, joint, expedition, ferengi, federation, personnel, beam, explore, encounter, mysterious, known, portal, presents, test		94.19720000000001	7	44	0	ferengi, vessel, steals, energy, unit, federation, base, enterprise, pursues, ships, rendered, immobile, pass, unknown, solar, system, believing, responsible, immobility, discuss, surrender, meanwhile, enterprise, probe, discovers, force, field, nearby, planet, actually, responsible, joint, expedition, ferengi, federation, personnel, beam, explore, encounter, mysterious, known, portal, presents, test		96.260417	7	44	0	ferengi, vessel, steals, energy, unit, federation, base, enterprise, pursues, ships, rendered, immobile, pass, unknown, solar, system, believing, responsible, immobility, discuss, surrender, meanwhile, enterprise, probe, discovers, force, field, nearby, planet, actually, responsible, joint, expedition, ferengi, federation, personnel, beam, explore, encounter, mysterious, known, portal, presents, test		93.49284	8	42	2	vessel, steals, energy, unit, federation, base, enterprise, pursues, ships, rendered, immobile, pass, unknown, solar, system, believing, responsible, immobility, discuss, surrender, meanwhile, enterprise, probe, discovers, force, field, nearby, planet, actually, responsible, joint, expedition, federation, personnel, beam, explore, encounter, mysterious, known, portal, presents, test	ferengi, ferengi	97.22026	1	44	0	ferengi, vessel, steals, energy, unit, federation, base, enterprise, pursues, ships, rendered, immobile, pass, unknown, solar, system, believing, responsible, immobility, discuss, surrender, meanwhile, enterprise, probe, discovers, force, field, nearby, planet, actually, responsible, joint, expedition, ferengi, federation, personnel, beam, explore, encounter, mysterious, known, portal, presents, test		93.66894	1	97	0	93.631476
4	106	Where No One Has Gone Before	1	5	1987-10-24 0:00:00	WHERE NO ONE HAS GONE BEFORE	Where No One Has Gone Before	" An engineer and his alien assistant board the Enterprise to perform an experiment that would increase warp engine output. During the experiment, something goes wrong and the Enterprise ends up in a place where thoughts become real. The assistant from a race of ""travelers"" with the scientific capabilities far beyond ours who tour the universe seeking those with potential. The traveler confides to Picard that Wesley is one of those beings with potential and should be guided and helped to grow. It is as a result of these comments, plus the knowledge and help that Wesley provides in Engineering that prompts Picard to make Crusher an acting ensign.  "	61	32	25	engineer_NOUN, alien_NOUN, assistant_NOUN, board_NOUN, enterprise_NOUN, experiment_NOUN, increase_VERB, engine_NOUN, output_NOUN, something_NOUN, wrong_ADJ, enterprise_NOUN, place_NOUN, become_VERB, real_ADJ, assistant_ADJ, race_NOUN, scientific_ADJ, far_ADV, potential_ADJ, traveler_NOUN, one_NUM, potential_ADJ, grow_VERB, result_NOUN, knowledge_NOUN, help_NOUN, engineering_NOUN, make_VERB, crusher_NOUN, acting_NOUN, ensign_NOUN	perform_NOUN, would_VERB, warp_ADJ, experiment_ADJ, goes_VERB, ends_VERB, thoughts_NOUN, travelers_NOUN, capabilities_NOUN, beyond_ADP, tour_ADJ, universe_ADJ, seeking_VERB, confides_NOUN, picard_VERB, wesley_ADP, beings_NOUN, guided_VERB, helped_VERB, comments_NOUN, plus_CONJ, wesley_VERB, provides_VERB, prompts_NOUN, picard_ADV	94.04635999999999	3	41	16	engineer_NOUN, alien_NOUN, assistant_NOUN, board_NOUN, enterprise_NOUN, perform_NOUN, experiment_NOUN, increase_VERB, warp_ADJ, engine_NOUN, output_NOUN, something_NOUN, wrong_ADJ, enterprise_NOUN, ends_VERB, place_NOUN, thoughts_NOUN, become_VERB, real_ADJ, assistant_ADJ, race_NOUN, scientific_ADJ, far_ADV, tour_ADJ, universe_ADJ, potential_ADJ, traveler_NOUN, one_NUM, potential_ADJ, guided_VERB, helped_VERB, grow_VERB, result_NOUN, comments_NOUN, knowledge_NOUN, help_NOUN, provides_VERB, engineering_NOUN, make_VERB, crusher_NOUN, ensign_NOUN	would_VERB, experiment_ADJ, goes_VERB, travelers_NOUN, capabilities_NOUN, beyond_ADP, seeking_VERB, confides_NOUN, picard_VERB, wesley_ADP, beings_NOUN, plus_CONJ, wesley_VERB, prompts_NOUN, picard_ADV, acting_NOUN	95.299244	1	57	0	engineer, alien, assistant, board, enterprise, perform, experiment, would, increase, warp, engine, output, experiment, something, goes, wrong, enterprise, ends, place, thoughts, become, real, assistant, race, travelers, scientific, capabilities, far, beyond, tour, universe, seeking, potential, traveler, confides, picard, wesley, one, beings, potential, guided, helped, grow, result, comments, plus, knowledge, help, wesley, provides, engineering, prompts, picard, make, crusher, acting, ensign		95.29548	70	57	0	engineer, alien, assistant, board, enterprise, perform, experiment, would, increase, warp, engine, output, experiment, something, goes, wrong, enterprise, ends, place, thoughts, become, real, assistant, race, travelers, scientific, capabilities, far, beyond, tour, universe, seeking, potential, traveler, confides, picard, wesley, one, beings, potential, guided, helped, grow, result, comments, plus, knowledge, help, wesley, provides, engineering, prompts, picard, make, crusher, acting, ensign		96.93173	83	57	0	engineer, alien, assistant, board, enterprise, perform, experiment, would, increase, warp, engine, output, experiment, something, goes, wrong, enterprise, ends, place, thoughts, become, real, assistant, race, travelers, scientific, capabilities, far, beyond, tour, universe, seeking, potential, traveler, confides, picard, wesley, one, beings, potential, guided, helped, grow, result, comments, plus, knowledge, help, wesley, provides, engineering, prompts, picard, make, crusher, acting, ensign		96.786344	5	57	0	engineer, alien, assistant, board, enterprise, perform, experiment, would, increase, warp, engine, output, experiment, something, goes, wrong, enterprise, ends, place, thoughts, become, real, assistant, race, travelers, scientific, capabilities, far, beyond, tour, universe, seeking, potential, traveler, confides, picard, wesley, one, beings, potential, guided, helped, grow, result, comments, plus, knowledge, help, wesley, provides, engineering, prompts, picard, make, crusher, acting, ensign		98.203814	7	57	0	engineer, alien, assistant, board, enterprise, perform, experiment, would, increase, warp, engine, output, experiment, something, goes, wrong, enterprise, ends, place, thoughts, become, real, assistant, race, travelers, scientific, capabilities, far, beyond, tour, universe, seeking, potential, traveler, confides, picard, wesley, one, beings, potential, guided, helped, grow, result, comments, plus, knowledge, help, wesley, provides, engineering, prompts, picard, make, crusher, acting, ensign		96.593773	9	57	0	engineer, alien, assistant, board, enterprise, perform, experiment, would, increase, warp, engine, output, experiment, something, goes, wrong, enterprise, ends, place, thoughts, become, real, assistant, race, travelers, scientific, capabilities, far, beyond, tour, universe, seeking, potential, traveler, confides, picard, wesley, one, beings, potential, guided, helped, grow, result, comments, plus, knowledge, help, wesley, provides, engineering, prompts, picard, make, crusher, acting, ensign		98.30487	1	57	0	engineer, alien, assistant, board, enterprise, perform, experiment, would, increase, warp, engine, output, experiment, something, goes, wrong, enterprise, ends, place, thoughts, become, real, assistant, race, travelers, scientific, capabilities, far, beyond, tour, universe, seeking, potential, traveler, confides, picard, wesley, one, beings, potential, guided, helped, grow, result, comments, plus, knowledge, help, wesley, provides, engineering, prompts, picard, make, crusher, acting, ensign		95.29613	3	123	0	93.614435
5	108	Lonely Among Us	1	6	1987-10-31 0:00:00	LONELY AMONG US	Lonely Among Us	 While on a mission to transport emissaries of two warring races to Parliament for negotiations, the Enterprise encounters a strange cloud consisting entirely of energy. As they pass, a bolt of energy strikes Worf and passes from crewman to crewman, killing one crewman and eventually taking over Picard's mind.  	6	15	15	mission_NOUN, transport_NOUN, two_NUM, races_NOUN, strange_ADJ, entirely_ADV, energy_NOUN, pass_NOUN, bolt_NOUN, energy_NOUN, crewman_NOUN, one_NUM, crewman_NOUN, eventually_ADV, mind_NOUN	emissaries_NOUN, warring_VERB, parliament_ADJ, negotiations_NOUN, enterprise_VERB, encounters_NOUN, cloud_ADJ, consisting_VERB, strikes_NOUN, worf_VERB, passes_NOUN, crewman_ADJ, killing_VERB, taking_VERB, picard_NOUN	90.64256	49	22	8	mission_NOUN, transport_NOUN, two_NUM, parliament_ADJ, enterprise_VERB, strange_ADJ, cloud_ADJ, consisting_VERB, entirely_ADV, energy_NOUN, pass_NOUN, bolt_NOUN, energy_NOUN, strikes_NOUN, passes_NOUN, crewman_NOUN, killing_VERB, one_NUM, crewman_NOUN, eventually_ADV, picard_NOUN, mind_NOUN	emissaries_NOUN, warring_VERB, races_NOUN, negotiations_NOUN, encounters_NOUN, worf_VERB, crewman_ADJ, taking_VERB	90.89303	30	30	0	mission, transport, emissaries, two, warring, races, parliament, negotiations, enterprise, encounters, strange, cloud, consisting, entirely, energy, pass, bolt, energy, strikes, worf, passes, crewman, crewman, killing, one, crewman, eventually, taking, picard, mind		89.878106	49	26	4	mission, transport, two, warring, races, parliament, negotiations, enterprise, encounters, strange, cloud, consisting, entirely, energy, pass, bolt, energy, strikes, worf, passes, killing, one, eventually, taking, picard, mind	emissaries, crewman, crewman, crewman	95.49525	52	26	4	mission, transport, two, warring, races, parliament, negotiations, enterprise, encounters, strange, cloud, consisting, entirely, energy, pass, bolt, energy, strikes, worf, passes, killing, one, eventually, taking, picard, mind	emissaries, crewman, crewman, crewman	95.72062	35	30	0	mission, transport, emissaries, two, warring, races, parliament, negotiations, enterprise, encounters, strange, cloud, consisting, entirely, energy, pass, bolt, energy, strikes, worf, passes, crewman, crewman, killing, one, crewman, eventually, taking, picard, mind		95.56074	42	30	0	mission, transport, emissaries, two, warring, races, parliament, negotiations, enterprise, encounters, strange, cloud, consisting, entirely, energy, pass, bolt, energy, strikes, worf, passes, crewman, crewman, killing, one, crewman, eventually, taking, picard, mind		92.91319999999999	39	29	1	mission, transport, emissaries, two, warring, races, parliament, negotiations, enterprise, encounters, strange, cloud, consisting, entirely, energy, pass, bolt, energy, strikes, passes, crewman, crewman, killing, one, crewman, eventually, taking, picard, mind	worf	96.14719000000001	42	30	0	mission, transport, emissaries, two, warring, races, parliament, negotiations, enterprise, encounters, strange, cloud, consisting, entirely, energy, pass, bolt, energy, strikes, worf, passes, crewman, crewman, killing, one, crewman, eventually, taking, picard, mind		92.22595700000001	12	63	0	93.044007
