53	155	The Enemy	3	7	1989-11-04 0:00:00	THE ENEMY	The Enemy	 The Enterprise investiages a distress call on a Federation planet with a particularly harsh surface and winds. The away team finds the remains of a Romulan ship and one Romulan, barely alive. The away team beams aboard the Enterprise with the Romulan, accidentally stranding Geordi on the planet where he, moments before beam-out time, stumbled into a pit. The crew of the Enterprise struggles to keep the Romulan alive and to locate Geordi on the surface. Meanwhile, on the surface, as Geordi moves closer to the beacon the Enterprise left to guide him, he is taken prisoner by a second Romulan, Bokra. Geordi attempts to convince Bokra that they must work together to stay alive and be rescued while a Romulan Warbird closes in on the Enterprise determined to retrieve their lost comrades from the grip of the Federation.  	1	35	43	enterprise_NOUN, call_NOUN, federation_NOUN, planet_NOUN, particularly_ADV, harsh_ADJ, surface_NOUN, away_ADV, one_NUM, barely_ADV, alive_ADJ, away_ADV, enterprise_NOUN, accidentally_ADV, planet_NOUN, time_NOUN, pit_NOUN, crew_NOUN, enterprise_NOUN, keep_VERB, alive_ADJ, surface_VERB, meanwhile_ADV, surface_VERB, closer_ADV, enterprise_NOUN, guide_NOUN, second_ADJ, convince_VERB, must_VERB, work_VERB, together_ADV, alive_ADJ, retrieve_VERB, federation_NOUN	investiages_VERB, distress_ADJ, winds_VERB, team_ADJ, finds_NOUN, remains_VERB, romulan_ADJ, ship_ADJ, romulan_NOUN, team_ADJ, beams_NOUN, aboard_ADP, romulan_NOUN, stranding_VERB, geordi_ADJ, moments_NOUN, beam_ADJ, stumbled_VERB, struggles_VERB, romulan_NOUN, locate_NOUN, geordi_NOUN, geordi_ADJ, moves_NOUN, beacon_ADV, left_VERB, taken_VERB, prisoner_ADJ, romulan_NOUN, bokra_NOUN, geordi_NOUN, attempts_NOUN, bokra_NOUN, stay_ADJ, rescued_VERB, romulan_ADJ, warbird_ADJ, closes_NOUN, enterprise_VERB, determined_VERB, lost_VERB, comrades_NOUN, grip_ADJ	93.680906	1	53	25	enterprise_NOUN, distress_ADJ, call_NOUN, federation_NOUN, planet_NOUN, particularly_ADV, harsh_ADJ, surface_NOUN, winds_VERB, away_ADV, remains_VERB, romulan_ADJ, ship_ADJ, one_NUM, romulan_NOUN, barely_ADV, alive_ADJ, away_ADV, enterprise_NOUN, romulan_NOUN, accidentally_ADV, planet_NOUN, moments_NOUN, time_NOUN, pit_NOUN, crew_NOUN, enterprise_NOUN, keep_VERB, romulan_NOUN, alive_ADJ, locate_NOUN, surface_VERB, surface_VERB, closer_ADV, enterprise_NOUN, left_VERB, guide_NOUN, taken_VERB, prisoner_ADJ, second_ADJ, romulan_NOUN, convince_VERB, work_VERB, together_ADV, stay_ADJ, alive_ADJ, romulan_ADJ, enterprise_VERB, determined_VERB, retrieve_VERB, lost_VERB, grip_ADJ, federation_NOUN	investiages_VERB, team_ADJ, finds_NOUN, team_ADJ, beams_NOUN, aboard_ADP, stranding_VERB, geordi_ADJ, beam_ADJ, stumbled_VERB, struggles_VERB, geordi_NOUN, meanwhile_ADV, geordi_ADJ, moves_NOUN, beacon_ADV, bokra_NOUN, geordi_NOUN, attempts_NOUN, bokra_NOUN, must_VERB, rescued_VERB, warbird_ADJ, closes_NOUN, comrades_NOUN	93.95025	1	75	3	enterprise, distress, call, federation, planet, particularly, harsh, surface, winds, away, team, finds, remains, romulan, ship, one, romulan, barely, alive, away, team, beams, aboard, enterprise, romulan, accidentally, stranding, geordi, planet, moments, beam, time, stumbled, pit, crew, enterprise, struggles, keep, romulan, alive, locate, geordi, surface, meanwhile, surface, geordi, moves, closer, beacon, enterprise, left, guide, taken, prisoner, second, romulan, geordi, attempts, convince, must, work, together, stay, alive, rescued, romulan, warbird, closes, enterprise, determined, retrieve, lost, comrades, grip, federation	investiages, bokra, bokra	91.83541	1	77	1	enterprise, distress, call, federation, planet, particularly, harsh, surface, winds, away, team, finds, remains, romulan, ship, one, romulan, barely, alive, away, team, beams, aboard, enterprise, romulan, accidentally, stranding, geordi, planet, moments, beam, time, stumbled, pit, crew, enterprise, struggles, keep, romulan, alive, locate, geordi, surface, meanwhile, surface, geordi, moves, closer, beacon, enterprise, left, guide, taken, prisoner, second, romulan, bokra, geordi, attempts, convince, bokra, must, work, together, stay, alive, rescued, romulan, warbird, closes, enterprise, determined, retrieve, lost, comrades, grip, federation	investiages	96.97740999999999	3	77	1	enterprise, distress, call, federation, planet, particularly, harsh, surface, winds, away, team, finds, remains, romulan, ship, one, romulan, barely, alive, away, team, beams, aboard, enterprise, romulan, accidentally, stranding, geordi, planet, moments, beam, time, stumbled, pit, crew, enterprise, struggles, keep, romulan, alive, locate, geordi, surface, meanwhile, surface, geordi, moves, closer, beacon, enterprise, left, guide, taken, prisoner, second, romulan, bokra, geordi, attempts, convince, bokra, must, work, together, stay, alive, rescued, romulan, warbird, closes, enterprise, determined, retrieve, lost, comrades, grip, federation	investiages	97.311896	1	77	1	enterprise, distress, call, federation, planet, particularly, harsh, surface, winds, away, team, finds, remains, romulan, ship, one, romulan, barely, alive, away, team, beams, aboard, enterprise, romulan, accidentally, stranding, geordi, planet, moments, beam, time, stumbled, pit, crew, enterprise, struggles, keep, romulan, alive, locate, geordi, surface, meanwhile, surface, geordi, moves, closer, beacon, enterprise, left, guide, taken, prisoner, second, romulan, bokra, geordi, attempts, convince, bokra, must, work, together, stay, alive, rescued, romulan, warbird, closes, enterprise, determined, retrieve, lost, comrades, grip, federation	investiages	97.326946	1	71	7	enterprise, distress, call, federation, planet, particularly, harsh, surface, winds, away, team, finds, remains, romulan, ship, one, romulan, barely, alive, away, team, beams, aboard, enterprise, romulan, accidentally, stranding, planet, moments, beam, time, stumbled, pit, crew, enterprise, struggles, keep, romulan, alive, locate, surface, meanwhile, surface, moves, closer, beacon, enterprise, left, guide, taken, prisoner, second, romulan, attempts, convince, must, work, together, stay, alive, rescued, romulan, warbird, closes, enterprise, determined, retrieve, lost, comrades, grip, federation	investiages, geordi, geordi, geordi, bokra, geordi, bokra	96.266675	1	65	13	enterprise, distress, call, federation, planet, particularly, harsh, surface, winds, away, team, finds, remains, ship, one, barely, alive, away, team, beams, aboard, enterprise, accidentally, stranding, planet, moments, beam, time, stumbled, pit, crew, enterprise, struggles, keep, alive, locate, surface, meanwhile, surface, moves, closer, beacon, enterprise, left, guide, taken, prisoner, second, attempts, convince, must, work, together, stay, alive, rescued, warbird, closes, enterprise, determined, retrieve, lost, comrades, grip, federation	investiages, romulan, romulan, romulan, geordi, romulan, geordi, geordi, romulan, bokra, geordi, bokra, romulan	97.88238	1	75	3	enterprise, distress, call, federation, planet, particularly, harsh, surface, winds, away, team, finds, remains, romulan, ship, one, romulan, barely, alive, away, team, beams, aboard, enterprise, romulan, accidentally, stranding, geordi, planet, moments, beam, time, stumbled, pit, crew, enterprise, struggles, keep, romulan, alive, locate, geordi, surface, meanwhile, surface, geordi, moves, closer, beacon, enterprise, left, guide, taken, prisoner, second, romulan, geordi, attempts, convince, must, work, together, stay, alive, rescued, romulan, warbird, closes, enterprise, determined, retrieve, lost, comrades, grip, federation	investiages, bokra, bokra	95.350796	1	177	0	93.85267499999999
54	156	The Price	3	8	1989-11-11 0:00:00	THE PRICE	The Price	 A race of beings known as the Barzan have discovered the only known stable wormhole and are willing to sell it to the highest bidder. The Enterprise carries several delegates to the site of the wormhole including a hired representative of the Chrysalian people who takes an interest in Troi. Geordi and Data enter the wormhole and discover that it is not truly stable. Meanwhile, Troi discovers that the representative of the Chrysalians, Ral, is part Betazoid and empathic and has been using his ability to gain unfair advantage in the negotiations.  	4	22	26	race_NOUN, stable_ADJ, wormhole_NOUN, willing_ADJ, sell_NOUN, highest_ADJ, bidder_NOUN, enterprise_NOUN, several_ADJ, site_NOUN, representative_ADJ, people_NOUN, interest_NOUN, data_NOUN, truly_ADV, stable_ADJ, part_NOUN, empathic_ADJ, ability_NOUN, gain_NOUN, unfair_ADJ, advantage_NOUN	beings_NOUN, known_VERB, barzan_ADV, discovered_VERB, known_VERB, carries_VERB, delegates_NOUN, wormhole_ADJ, including_VERB, hired_ADJ, chrysalian_ADJ, takes_VERB, troi_NOUN, geordi_NOUN, enter_NOUN, wormhole_VERB, discover_NOUN, meanwhile_ADJ, troi_NOUN, discovers_NOUN, representative_VERB, chrysalians_NOUN, ral_ADJ, betazoid_NOUN, using_VERB, negotiations_NOUN	91.12046000000001	1	36	12	race_NOUN, known_VERB, known_VERB, stable_ADJ, wormhole_NOUN, willing_ADJ, sell_NOUN, highest_ADJ, bidder_NOUN, enterprise_NOUN, several_ADJ, delegates_NOUN, site_NOUN, wormhole_ADJ, including_VERB, hired_ADJ, representative_ADJ, people_NOUN, takes_VERB, interest_NOUN, troi_NOUN, data_NOUN, enter_NOUN, discover_NOUN, truly_ADV, stable_ADJ, meanwhile_ADJ, troi_NOUN, representative_VERB, ral_ADJ, part_NOUN, empathic_ADJ, ability_NOUN, gain_NOUN, unfair_ADJ, advantage_NOUN	beings_NOUN, barzan_ADV, discovered_VERB, carries_VERB, chrysalian_ADJ, geordi_NOUN, wormhole_VERB, discovers_NOUN, chrysalians_NOUN, betazoid_NOUN, using_VERB, negotiations_NOUN	94.05443	3	45	3	race, beings, known, barzan, discovered, known, stable, wormhole, willing, sell, highest, bidder, enterprise, carries, several, delegates, site, wormhole, including, hired, representative, people, takes, interest, troi, geordi, data, enter, wormhole, discover, truly, stable, meanwhile, troi, discovers, representative, ral, part, empathic, using, ability, gain, unfair, advantage, negotiations	chrysalian, chrysalians, betazoid	91.44337	25	44	4	race, beings, known, discovered, known, stable, wormhole, willing, sell, highest, bidder, enterprise, carries, several, delegates, site, wormhole, including, hired, representative, people, takes, interest, troi, geordi, data, enter, wormhole, discover, truly, stable, meanwhile, troi, discovers, representative, ral, part, empathic, using, ability, gain, unfair, advantage, negotiations	barzan, chrysalian, chrysalians, betazoid	94.30114	38	44	4	race, beings, known, discovered, known, stable, wormhole, willing, sell, highest, bidder, enterprise, carries, several, delegates, site, wormhole, including, hired, representative, people, takes, interest, troi, geordi, data, enter, wormhole, discover, truly, stable, meanwhile, troi, discovers, representative, ral, part, empathic, using, ability, gain, unfair, advantage, negotiations	barzan, chrysalian, chrysalians, betazoid	94.22296999999999	2	46	2	race, beings, known, barzan, discovered, known, stable, wormhole, willing, sell, highest, bidder, enterprise, carries, several, delegates, site, wormhole, including, hired, representative, people, takes, interest, troi, geordi, data, enter, wormhole, discover, truly, stable, meanwhile, troi, discovers, representative, ral, part, betazoid, empathic, using, ability, gain, unfair, advantage, negotiations	chrysalian, chrysalians	96.68877	4	43	5	race, beings, known, discovered, known, stable, wormhole, willing, sell, highest, bidder, enterprise, carries, several, delegates, site, wormhole, including, hired, representative, people, takes, interest, troi, data, enter, wormhole, discover, truly, stable, meanwhile, troi, discovers, representative, ral, part, empathic, using, ability, gain, unfair, advantage, negotiations	barzan, chrysalian, geordi, chrysalians, betazoid	94.422054	1	43	5	race, beings, known, discovered, known, stable, wormhole, willing, sell, highest, bidder, enterprise, carries, several, delegates, site, wormhole, including, hired, representative, people, takes, interest, troi, data, enter, wormhole, discover, truly, stable, meanwhile, troi, discovers, representative, ral, part, empathic, using, ability, gain, unfair, advantage, negotiations	barzan, chrysalian, geordi, chrysalians, betazoid	97.51835	1	44	4	race, beings, known, discovered, known, stable, wormhole, willing, sell, highest, bidder, enterprise, carries, several, delegates, site, wormhole, including, hired, representative, people, takes, interest, troi, geordi, data, enter, wormhole, discover, truly, stable, meanwhile, troi, discovers, representative, ral, part, empathic, using, ability, gain, unfair, advantage, negotiations	barzan, chrysalian, chrysalians, betazoid	93.604434	7	117	0	92.95801
55	157	The Vengeance Factor	3	9	1989-11-18 0:00:00	THE VENGEANCE FACTOR	The Vengeance Factor	 A science outpost is attacked by the Gatherers, a band of Acamarian renegades. Picard talks with Marook, the Sovereign of Acamar Three, who wants to hunt the Gatherers down and destroy them. Picard convinces her to attempt to negotiate first and she and her cook board the Enterprise to travel to a Gatherer outpost to open talks. While there, the leader of the group is killed by a mysterious assassin.  	3	19	16	science_NOUN, outpost_NOUN, band_VERB, sovereign_ADJ, three_NUM, hunt_NOUN, destroy_VERB, attempt_VERB, first_ADJ, cook_NOUN, board_NOUN, enterprise_NOUN, travel_NOUN, gatherer_NOUN, open_ADJ, leader_NOUN, group_NOUN, mysterious_ADJ, assassin_NOUN	attacked_VERB, gatherers_NOUN, acamarian_ADJ, renegades_NOUN, picard_VERB, talks_NOUN, marook_VERB, acamar_NOUN, wants_VERB, gatherers_NOUN, picard_NOUN, convinces_NOUN, negotiate_ADJ, outpost_VERB, talks_NOUN, killed_VERB	91.31864	11	25	10	science_NOUN, outpost_NOUN, band_VERB, talks_NOUN, sovereign_ADJ, three_NUM, wants_VERB, hunt_NOUN, destroy_VERB, picard_NOUN, attempt_VERB, negotiate_ADJ, first_ADJ, cook_NOUN, board_NOUN, enterprise_NOUN, travel_NOUN, gatherer_NOUN, outpost_VERB, open_ADJ, talks_NOUN, leader_NOUN, group_NOUN, mysterious_ADJ, assassin_NOUN	attacked_VERB, gatherers_NOUN, acamarian_ADJ, renegades_NOUN, picard_VERB, marook_VERB, acamar_NOUN, gatherers_NOUN, convinces_NOUN, killed_VERB	91.780496	16	32	3	science, outpost, attacked, gatherers, band, renegades, picard, talks, sovereign, three, wants, hunt, gatherers, destroy, picard, convinces, attempt, negotiate, first, cook, board, enterprise, travel, gatherer, outpost, open, talks, leader, group, killed, mysterious, assassin	acamarian, marook, acamar	87.11213	31	32	3	science, outpost, attacked, gatherers, band, renegades, picard, talks, sovereign, three, wants, hunt, gatherers, destroy, picard, convinces, attempt, negotiate, first, cook, board, enterprise, travel, gatherer, outpost, open, talks, leader, group, killed, mysterious, assassin	acamarian, marook, acamar	93.64919	38	32	3	science, outpost, attacked, gatherers, band, renegades, picard, talks, sovereign, three, wants, hunt, gatherers, destroy, picard, convinces, attempt, negotiate, first, cook, board, enterprise, travel, gatherer, outpost, open, talks, leader, group, killed, mysterious, assassin	acamarian, marook, acamar	93.40299399999999	13	33	2	science, outpost, attacked, gatherers, band, renegades, picard, talks, sovereign, acamar, three, wants, hunt, gatherers, destroy, picard, convinces, attempt, negotiate, first, cook, board, enterprise, travel, gatherer, outpost, open, talks, leader, group, killed, mysterious, assassin	acamarian, marook	94.46293	11	32	3	science, outpost, attacked, gatherers, band, renegades, picard, talks, sovereign, three, wants, hunt, gatherers, destroy, picard, convinces, attempt, negotiate, first, cook, board, enterprise, travel, gatherer, outpost, open, talks, leader, group, killed, mysterious, assassin	acamarian, marook, acamar	90.81195600000001	5	32	3	science, outpost, attacked, gatherers, band, renegades, picard, talks, sovereign, three, wants, hunt, gatherers, destroy, picard, convinces, attempt, negotiate, first, cook, board, enterprise, travel, gatherer, outpost, open, talks, leader, group, killed, mysterious, assassin	acamarian, marook, acamar	95.77657	3	32	3	science, outpost, attacked, gatherers, band, renegades, picard, talks, sovereign, three, wants, hunt, gatherers, destroy, picard, convinces, attempt, negotiate, first, cook, board, enterprise, travel, gatherer, outpost, open, talks, leader, group, killed, mysterious, assassin	acamarian, marook, acamar	91.20414	1	92	0	94.326913
56	158	The Defector	3	10	1989-12-30 0:00:00	THE DEFECTOR	The Defector	 A Romulan scoutship, with a Romulan Warbird in pursuit, hails the Enterprise and requests asylum. After the Enterprise easily chases off the Warbird, they beam aboard the occupant of the scoutship, Setal, who has information about a new Romulan offensive. The Enterprise crew, skeptical about the defector's claims and motives and attempting to get at the truth, travels to Nelvana 3 where there is supposed to be a Romulan base at which a large Romulan fleet will gather to launch an offensive against the Federation.  	2	19	24	pursuit_NOUN, easily_ADV, aboard_ADV, information_NOUN, new_ADJ, offensive_ADJ, enterprise_NOUN, crew_NOUN, skeptical_ADJ, defector_NOUN, truth_NOUN, travels_NOUN, base_NOUN, large_ADJ, fleet_NOUN, gather_NOUN, launch_NOUN, offensive_ADJ, federation_NOUN	romulan_NOUN, scoutship_NOUN, romulan_NOUN, warbird_VERB, hails_NOUN, enterprise_VERB, requests_NOUN, asylum_VERB, enterprise_VERB, chases_NOUN, warbird_VERB, beam_ADV, occupant_ADJ, scoutship_NOUN, setal_ADJ, romulan_NOUN, claims_NOUN, motives_NOUN, attempting_VERB, get_NOUN, nelvana_VERB, supposed_VERB, romulan_NOUN, romulan_NOUN	91.658723	3	29	14	romulan_NOUN, romulan_NOUN, pursuit_NOUN, enterprise_VERB, asylum_VERB, enterprise_VERB, easily_ADV, aboard_ADV, occupant_ADJ, information_NOUN, new_ADJ, romulan_NOUN, offensive_ADJ, enterprise_NOUN, crew_NOUN, skeptical_ADJ, defector_NOUN, get_NOUN, truth_NOUN, supposed_VERB, romulan_NOUN, base_NOUN, large_ADJ, romulan_NOUN, fleet_NOUN, gather_NOUN, launch_NOUN, offensive_ADJ, federation_NOUN	scoutship_NOUN, warbird_VERB, hails_NOUN, requests_NOUN, chases_NOUN, warbird_VERB, beam_ADV, scoutship_NOUN, setal_ADJ, claims_NOUN, motives_NOUN, attempting_VERB, travels_NOUN, nelvana_VERB	90.939367	3	40	3	romulan, romulan, warbird, pursuit, hails, enterprise, requests, asylum, enterprise, easily, chases, warbird, beam, aboard, occupant, information, new, romulan, offensive, enterprise, crew, skeptical, defector, claims, motives, attempting, get, truth, travels, nelvana, supposed, romulan, base, large, romulan, fleet, gather, launch, offensive, federation	scoutship, scoutship, setal	82.90946500000001	6	39	4	romulan, romulan, warbird, pursuit, hails, enterprise, requests, asylum, enterprise, easily, chases, warbird, beam, aboard, occupant, information, new, romulan, offensive, enterprise, crew, skeptical, defector, claims, motives, attempting, get, truth, travels, supposed, romulan, base, large, romulan, fleet, gather, launch, offensive, federation	scoutship, scoutship, setal, nelvana	90.740657	6	39	4	romulan, romulan, warbird, pursuit, hails, enterprise, requests, asylum, enterprise, easily, chases, warbird, beam, aboard, occupant, information, new, romulan, offensive, enterprise, crew, skeptical, defector, claims, motives, attempting, get, truth, travels, supposed, romulan, base, large, romulan, fleet, gather, launch, offensive, federation	scoutship, scoutship, setal, nelvana	90.671957	2	43	0	romulan, scoutship, romulan, warbird, pursuit, hails, enterprise, requests, asylum, enterprise, easily, chases, warbird, beam, aboard, occupant, scoutship, setal, information, new, romulan, offensive, enterprise, crew, skeptical, defector, claims, motives, attempting, get, truth, travels, nelvana, supposed, romulan, base, large, romulan, fleet, gather, launch, offensive, federation		93.05780999999999	2	40	3	romulan, romulan, warbird, pursuit, hails, enterprise, requests, asylum, enterprise, easily, chases, warbird, beam, aboard, occupant, setal, information, new, romulan, offensive, enterprise, crew, skeptical, defector, claims, motives, attempting, get, truth, travels, supposed, romulan, base, large, romulan, fleet, gather, launch, offensive, federation	scoutship, scoutship, nelvana	89.106894	1	35	8	warbird, pursuit, hails, enterprise, requests, asylum, enterprise, easily, chases, warbird, beam, aboard, occupant, setal, information, new, offensive, enterprise, crew, skeptical, defector, claims, motives, attempting, get, truth, travels, supposed, base, large, fleet, gather, launch, offensive, federation	romulan, scoutship, romulan, scoutship, romulan, nelvana, romulan, romulan	96.681345	3	42	1	romulan, scoutship, romulan, warbird, pursuit, hails, enterprise, requests, asylum, enterprise, easily, chases, warbird, beam, aboard, occupant, scoutship, setal, information, new, romulan, offensive, enterprise, crew, skeptical, defector, claims, motives, attempting, get, truth, travels, supposed, romulan, base, large, romulan, fleet, gather, launch, offensive, federation	nelvana	91.092324	9	113	0	91.901827
57	159	The Hunted	3	11	1990-01-06 0:00:00	THE HUNTED	The Hunted	 The Enterprise visist Angosia 3, a planet which has applied for membership in the Federation. While there, a prisoner escapes jail and Prime Minister Narok asks for assistance in recapturing him. The Enterprise succeeds in capturing him, only to find that he is extremely dangerous and not all that Narok has claimed him to be.  	1	13	11	enterprise_NOUN, planet_NOUN, membership_NOUN, federation_NOUN, prisoner_NOUN, jail_VERB, prime_ADJ, minister_NOUN, assistance_NOUN, enterprise_NOUN, find_VERB, extremely_ADV, dangerous_ADJ	visist_NOUN, angosia_ADJ, applied_VERB, escapes_NOUN, narok_NOUN, asks_VERB, recapturing_VERB, succeeds_VERB, capturing_VERB, narok_NOUN, claimed_VERB	87.809587	1	16	8	enterprise_NOUN, planet_NOUN, applied_VERB, membership_NOUN, federation_NOUN, prisoner_NOUN, jail_VERB, prime_ADJ, minister_NOUN, asks_VERB, assistance_NOUN, enterprise_NOUN, capturing_VERB, find_VERB, extremely_ADV, dangerous_ADJ	visist_NOUN, angosia_ADJ, escapes_NOUN, narok_NOUN, recapturing_VERB, succeeds_VERB, narok_NOUN, claimed_VERB	89.83644	4	22	2	enterprise, planet, applied, membership, federation, prisoner, escapes, jail, prime, minister, narok, asks, assistance, recapturing, enterprise, succeeds, capturing, find, extremely, dangerous, narok, claimed	visist, angosia	87.111866	1	21	3	enterprise, planet, applied, membership, federation, prisoner, escapes, jail, prime, minister, narok, asks, assistance, enterprise, succeeds, capturing, find, extremely, dangerous, narok, claimed	visist, angosia, recapturing	92.33838300000001	1	21	3	enterprise, planet, applied, membership, federation, prisoner, escapes, jail, prime, minister, narok, asks, assistance, enterprise, succeeds, capturing, find, extremely, dangerous, narok, claimed	visist, angosia, recapturing	93.11098	2	23	1	enterprise, visist, planet, applied, membership, federation, prisoner, escapes, jail, prime, minister, narok, asks, assistance, recapturing, enterprise, succeeds, capturing, find, extremely, dangerous, narok, claimed	angosia	94.28673400000001	2	21	3	enterprise, visist, planet, applied, membership, federation, prisoner, escapes, jail, prime, minister, asks, assistance, recapturing, enterprise, succeeds, capturing, find, extremely, dangerous, claimed	angosia, narok, narok	92.096364	1	21	3	enterprise, visist, planet, applied, membership, federation, prisoner, escapes, jail, prime, minister, asks, assistance, recapturing, enterprise, succeeds, capturing, find, extremely, dangerous, claimed	angosia, narok, narok	96.21141	1	21	3	enterprise, visist, planet, applied, membership, federation, prisoner, escapes, jail, prime, minister, asks, assistance, recapturing, enterprise, succeeds, capturing, find, extremely, dangerous, claimed	angosia, narok, narok	89.962065	1	70	0	94.39725
