119	221	The Perfect Mate	5	21	1992-04-27 0:00:00	THE PERFECT MATE	The Perfect Mate	 A beautiful metamorph is being delivered by Ambassador Briam as a peace offering to end a centuries-long war. Unfortunately, she falls in love with Picard before she can be delivered to Chancellor Alrik. Meanwhile, two Ferengi are on board the ship attempting to gain control of the metamorph, a highly desirable and rare prize since she can shape herself to the needs and desires of any male.  	2	19	17	beautiful_ADJ, peace_NOUN, long_ADJ, war_NOUN, unfortunately_ADV, love_VERB, chancellor_NOUN, meanwhile_ADV, two_NUM, board_NOUN, ship_NOUN, gain_NOUN, control_NOUN, highly_ADV, desirable_ADJ, rare_ADJ, prize_NOUN, shape_NOUN, male_NOUN	metamorph_NOUN, delivered_VERB, ambassador_ADJ, briam_NOUN, offering_VERB, end_ADJ, centuries_NOUN, falls_VERB, picard_NOUN, delivered_VERB, alrik_NOUN, ferengi_NOUN, attempting_VERB, metamorph_VERB, since_ADP, needs_VERB, desires_NOUN	93.80753	1	24	12	beautiful_ADJ, delivered_VERB, ambassador_ADJ, peace_NOUN, offering_VERB, end_ADJ, long_ADJ, war_NOUN, unfortunately_ADV, love_VERB, picard_NOUN, delivered_VERB, chancellor_NOUN, two_NUM, board_NOUN, ship_NOUN, gain_NOUN, control_NOUN, desirable_ADJ, rare_ADJ, prize_NOUN, shape_NOUN, needs_VERB, male_NOUN	metamorph_NOUN, briam_NOUN, centuries_NOUN, falls_VERB, alrik_NOUN, meanwhile_ADV, ferengi_NOUN, attempting_VERB, metamorph_VERB, highly_ADV, since_ADP, desires_NOUN	92.641693	1	34	2	beautiful, metamorph, delivered, ambassador, peace, offering, end, centuries, long, war, unfortunately, falls, love, picard, delivered, chancellor, meanwhile, two, ferengi, board, ship, attempting, gain, control, metamorph, highly, desirable, rare, prize, since, shape, needs, desires, male	briam, alrik	94.58511	2	32	4	beautiful, delivered, ambassador, peace, offering, end, centuries, long, war, unfortunately, falls, love, picard, delivered, chancellor, meanwhile, two, ferengi, board, ship, attempting, gain, control, highly, desirable, rare, prize, since, shape, needs, desires, male	metamorph, briam, alrik, metamorph	97.90019	3	32	4	beautiful, delivered, ambassador, peace, offering, end, centuries, long, war, unfortunately, falls, love, picard, delivered, chancellor, meanwhile, two, ferengi, board, ship, attempting, gain, control, highly, desirable, rare, prize, since, shape, needs, desires, male	metamorph, briam, alrik, metamorph	98.214096	1	36	0	beautiful, metamorph, delivered, ambassador, briam, peace, offering, end, centuries, long, war, unfortunately, falls, love, picard, delivered, chancellor, alrik, meanwhile, two, ferengi, board, ship, attempting, gain, control, metamorph, highly, desirable, rare, prize, since, shape, needs, desires, male		98.066115	1	34	2	beautiful, metamorph, delivered, ambassador, peace, offering, end, centuries, long, war, unfortunately, falls, love, picard, delivered, chancellor, meanwhile, two, ferengi, board, ship, attempting, gain, control, metamorph, highly, desirable, rare, prize, since, shape, needs, desires, male	briam, alrik	96.66269	1	33	3	beautiful, metamorph, delivered, ambassador, peace, offering, end, centuries, long, war, unfortunately, falls, love, picard, delivered, chancellor, meanwhile, two, board, ship, attempting, gain, control, metamorph, highly, desirable, rare, prize, since, shape, needs, desires, male	briam, alrik, ferengi	98.296595	1	34	2	beautiful, metamorph, delivered, ambassador, peace, offering, end, centuries, long, war, unfortunately, falls, love, picard, delivered, chancellor, meanwhile, two, ferengi, board, ship, attempting, gain, control, metamorph, highly, desirable, rare, prize, since, shape, needs, desires, male	briam, alrik	95.20726	1	82	0	94.027734
120	222	Imaginary Friend	5	22	1992-05-04 0:00:00	IMAGINARY FRIEND	Imaginary Friend	 A young girl's imaginary friend takes on new life as the Enterprise investigates a newly formed nebula around a neutron star.  	34	10	5	young_ADJ, girl_NOUN, imaginary_ADJ, friend_NOUN, new_ADJ, life_NOUN, enterprise_NOUN, newly_ADV, nebula_NOUN, star_NOUN	takes_VERB, investigates_VERB, formed_VERB, around_ADP, neutron_X	88.268536	19	12	3	young_ADJ, girl_NOUN, imaginary_ADJ, friend_NOUN, takes_VERB, new_ADJ, life_NOUN, enterprise_NOUN, newly_ADV, formed_VERB, nebula_NOUN, star_NOUN	investigates_VERB, around_ADP, neutron_X	85.62205	18	15	0	young, girl, imaginary, friend, takes, new, life, enterprise, investigates, newly, formed, nebula, around, neutron, star		85.497046	93	15	0	young, girl, imaginary, friend, takes, new, life, enterprise, investigates, newly, formed, nebula, around, neutron, star		94.71813999999999	112	15	0	young, girl, imaginary, friend, takes, new, life, enterprise, investigates, newly, formed, nebula, around, neutron, star		95.139325	19	15	0	young, girl, imaginary, friend, takes, new, life, enterprise, investigates, newly, formed, nebula, around, neutron, star		94.74913000000001	42	15	0	young, girl, imaginary, friend, takes, new, life, enterprise, investigates, newly, formed, nebula, around, neutron, star		89.638424	60	15	0	young, girl, imaginary, friend, takes, new, life, enterprise, investigates, newly, formed, nebula, around, neutron, star		94.230384	50	15	0	young, girl, imaginary, friend, takes, new, life, enterprise, investigates, newly, formed, nebula, around, neutron, star		86.89737	1	25	0	92.16413
121	223	I, Borg	5	23	1992-05-11 0:00:00	I, BORG	I, Borg	 The Enterprise encounters a crashed Borg scout ship and rescues a Borg from the wreckage. Picard plans to use the Borg to destroy the rest of his race by infecting the Borg with a computer virus and returning him to the Borg. However, as the crew works with the Borg to discover his programming so they can write the virus, they begin to have doubts about using him to destroy the rest of his race.  	39	15	21	enterprise_NOUN, scout_NOUN, ship_NOUN, wreckage_NOUN, use_VERB, rest_NOUN, race_NOUN, computer_NOUN, virus_NOUN, however_ADV, crew_VERB, virus_NOUN, begin_NOUN, rest_NOUN, race_NOUN	encounters_NOUN, crashed_VERB, borg_NOUN, rescues_VERB, borg_ADJ, picard_NOUN, plans_NOUN, borg_ADJ, destroy_NOUN, infecting_VERB, borg_ADJ, returning_VERB, borg_NOUN, works_NOUN, borg_VERB, discover_ADV, programming_VERB, write_ADJ, doubts_NOUN, using_VERB, destroy_ADJ	89.70082000000001	3	30	6	enterprise_NOUN, crashed_VERB, borg_NOUN, scout_NOUN, ship_NOUN, borg_ADJ, wreckage_NOUN, picard_NOUN, use_VERB, borg_ADJ, destroy_NOUN, rest_NOUN, race_NOUN, borg_ADJ, computer_NOUN, virus_NOUN, returning_VERB, borg_NOUN, however_ADV, crew_VERB, works_NOUN, discover_ADV, programming_VERB, write_ADJ, virus_NOUN, begin_NOUN, doubts_NOUN, destroy_ADJ, rest_NOUN, race_NOUN	encounters_NOUN, rescues_VERB, plans_NOUN, infecting_VERB, borg_VERB, using_VERB	90.08300299999999	3	36	0	enterprise, encounters, crashed, borg, scout, ship, rescues, borg, wreckage, picard, plans, use, borg, destroy, rest, race, infecting, borg, computer, virus, returning, borg, however, crew, works, borg, discover, programming, write, virus, begin, doubts, using, destroy, rest, race		88.645446	4	36	0	enterprise, encounters, crashed, borg, scout, ship, rescues, borg, wreckage, picard, plans, use, borg, destroy, rest, race, infecting, borg, computer, virus, returning, borg, however, crew, works, borg, discover, programming, write, virus, begin, doubts, using, destroy, rest, race		94.267553	8	36	0	enterprise, encounters, crashed, borg, scout, ship, rescues, borg, wreckage, picard, plans, use, borg, destroy, rest, race, infecting, borg, computer, virus, returning, borg, however, crew, works, borg, discover, programming, write, virus, begin, doubts, using, destroy, rest, race		94.58171	3	36	0	enterprise, encounters, crashed, borg, scout, ship, rescues, borg, wreckage, picard, plans, use, borg, destroy, rest, race, infecting, borg, computer, virus, returning, borg, however, crew, works, borg, discover, programming, write, virus, begin, doubts, using, destroy, rest, race		95.17971	4	36	0	enterprise, encounters, crashed, borg, scout, ship, rescues, borg, wreckage, picard, plans, use, borg, destroy, rest, race, infecting, borg, computer, virus, returning, borg, however, crew, works, borg, discover, programming, write, virus, begin, doubts, using, destroy, rest, race		91.634274	2	36	0	enterprise, encounters, crashed, borg, scout, ship, rescues, borg, wreckage, picard, plans, use, borg, destroy, rest, race, infecting, borg, computer, virus, returning, borg, however, crew, works, borg, discover, programming, write, virus, begin, doubts, using, destroy, rest, race		95.25388500000001	2	36	0	enterprise, encounters, crashed, borg, scout, ship, rescues, borg, wreckage, picard, plans, use, borg, destroy, rest, race, infecting, borg, computer, virus, returning, borg, however, crew, works, borg, discover, programming, write, virus, begin, doubts, using, destroy, rest, race		90.76693	2	84	0	92.45103999999999
122	224	The Next Phase	5	24	1992-05-18 0:00:00	THE NEXT PHASE	The Next Phase	 The Enterprise assists a damaged Romulan vessel but, when Geordi and Ro attempt to beam back to the Enterprise with some damaged equipment that needs replacing, they fail to rematerialize and cannot be found by the sensors.  Ro and Geordi are presumed dead, but they have not died. They discover they are in a cloaked, phased state where they can see and hear the crew but the crew cannot see or hear them. As they attempt to deal with their situation they uncover a plot by the Romulans to destroy the Enterprise and must find a way to return to normal, if possible, and warn their fellow crewmembers.  	9	31	20	enterprise_NOUN, assists_NOUN, vessel_NOUN, ro_NOUN, attempt_NOUN, beam_NOUN, back_ADV, enterprise_NOUN, equipment_NOUN, needs_NOUN, fail_NOUN, found_VERB, dead_ADJ, phased_ADJ, state_NOUN, crew_NOUN, crew_VERB, see_VERB, deal_NOUN, situation_NOUN, plot_NOUN, destroy_VERB, enterprise_NOUN, must_VERB, find_VERB, way_NOUN, return_VERB, normal_ADJ, possible_ADJ, warn_NOUN, fellow_NOUN	damaged_VERB, romulan_ADJ, geordi_NOUN, damaged_VERB, replacing_VERB, rematerialize_NOUN, sensors_NOUN, ro_VERB, geordi_NOUN, presumed_VERB, died_VERB, discover_NOUN, cloaked_VERB, see_NOUN, hear_ADJ, hear_ADJ, attempt_ADJ, uncover_NOUN, romulans_NOUN, crewmembers_NOUN	93.256855	3	40	11	enterprise_NOUN, damaged_VERB, romulan_ADJ, vessel_NOUN, ro_NOUN, attempt_NOUN, beam_NOUN, back_ADV, enterprise_NOUN, damaged_VERB, equipment_NOUN, needs_NOUN, replacing_VERB, fail_NOUN, found_VERB, ro_VERB, dead_ADJ, died_VERB, discover_NOUN, state_NOUN, see_NOUN, hear_ADJ, crew_NOUN, crew_VERB, see_VERB, hear_ADJ, attempt_ADJ, deal_NOUN, situation_NOUN, uncover_NOUN, plot_NOUN, destroy_VERB, enterprise_NOUN, find_VERB, way_NOUN, return_VERB, normal_ADJ, possible_ADJ, warn_NOUN, fellow_NOUN	assists_NOUN, geordi_NOUN, rematerialize_NOUN, sensors_NOUN, geordi_NOUN, presumed_VERB, cloaked_VERB, phased_ADJ, romulans_NOUN, must_VERB, crewmembers_NOUN	93.47634000000001	4	50	1	enterprise, assists, damaged, romulan, vessel, geordi, ro, attempt, beam, back, enterprise, damaged, equipment, needs, replacing, fail, found, sensors, ro, geordi, presumed, dead, died, discover, cloaked, phased, state, see, hear, crew, crew, see, hear, attempt, deal, situation, uncover, plot, romulans, destroy, enterprise, must, find, way, return, normal, possible, warn, fellow, crewmembers	rematerialize	94.228506	11	48	3	enterprise, assists, damaged, romulan, vessel, geordi, ro, attempt, beam, back, enterprise, damaged, equipment, needs, replacing, fail, found, sensors, ro, geordi, presumed, dead, died, discover, cloaked, phased, state, see, hear, crew, crew, see, hear, attempt, deal, situation, uncover, plot, destroy, enterprise, must, find, way, return, normal, possible, warn, fellow	rematerialize, romulans, crewmembers	97.814846	12	48	3	enterprise, assists, damaged, romulan, vessel, geordi, ro, attempt, beam, back, enterprise, damaged, equipment, needs, replacing, fail, found, sensors, ro, geordi, presumed, dead, died, discover, cloaked, phased, state, see, hear, crew, crew, see, hear, attempt, deal, situation, uncover, plot, destroy, enterprise, must, find, way, return, normal, possible, warn, fellow	rematerialize, romulans, crewmembers	97.997826	2	51	0	enterprise, assists, damaged, romulan, vessel, geordi, ro, attempt, beam, back, enterprise, damaged, equipment, needs, replacing, fail, rematerialize, found, sensors, ro, geordi, presumed, dead, died, discover, cloaked, phased, state, see, hear, crew, crew, see, hear, attempt, deal, situation, uncover, plot, romulans, destroy, enterprise, must, find, way, return, normal, possible, warn, fellow, crewmembers		97.92456	7	49	2	enterprise, assists, damaged, romulan, vessel, ro, attempt, beam, back, enterprise, damaged, equipment, needs, replacing, fail, rematerialize, found, sensors, ro, presumed, dead, died, discover, cloaked, phased, state, see, hear, crew, crew, see, hear, attempt, deal, situation, uncover, plot, romulans, destroy, enterprise, must, find, way, return, normal, possible, warn, fellow, crewmembers	geordi, geordi	96.734977	7	47	4	enterprise, assists, damaged, vessel, ro, attempt, beam, back, enterprise, damaged, equipment, needs, replacing, fail, rematerialize, found, sensors, ro, presumed, dead, died, discover, cloaked, phased, state, see, hear, crew, crew, see, hear, attempt, deal, situation, uncover, plot, destroy, enterprise, must, find, way, return, normal, possible, warn, fellow, crewmembers	romulan, geordi, geordi, romulans	97.99571	2	51	0	enterprise, assists, damaged, romulan, vessel, geordi, ro, attempt, beam, back, enterprise, damaged, equipment, needs, replacing, fail, rematerialize, found, sensors, ro, geordi, presumed, dead, died, discover, cloaked, phased, state, see, hear, crew, crew, see, hear, attempt, deal, situation, uncover, plot, romulans, destroy, enterprise, must, find, way, return, normal, possible, warn, fellow, crewmembers		95.281553	4	131	0	92.653793
123	225	The Inner Light	5	25	1992-06-01 0:00:00	THE INNER LIGHT	The Inner Light	 The Enterprise encounters a mysterious probe which seems to attack Picard knocking him unconscious. However, as he lays on the bridge in an apparent coma for only a few minutes, Picard imagines that he is a scientest named Kamin living a doomed planet a long time ago.  	58	10	16	enterprise_NOUN, mysterious_ADJ, probe_NOUN, unconscious_ADJ, however_ADV, bridge_NOUN, apparent_ADJ, coma_NOUN, long_ADJ, time_NOUN	encounters_NOUN, seems_VERB, attack_PRT, picard_ADJ, knocking_VERB, lays_VERB, minutes_NOUN, picard_VERB, imagines_NOUN, scientest_ADV, named_VERB, kamin_NOUN, living_VERB, doomed_VERB, planet_ADJ, ago_ADP	86.49688	40	14	12	enterprise_NOUN, mysterious_ADJ, probe_NOUN, unconscious_ADJ, however_ADV, bridge_NOUN, apparent_ADJ, coma_NOUN, minutes_NOUN, named_VERB, living_VERB, planet_ADJ, long_ADJ, time_NOUN	encounters_NOUN, seems_VERB, attack_PRT, picard_ADJ, knocking_VERB, lays_VERB, picard_VERB, imagines_NOUN, scientest_ADV, kamin_NOUN, doomed_VERB, ago_ADP	89.166	91	25	1	enterprise, encounters, mysterious, probe, seems, attack, picard, knocking, unconscious, however, lays, bridge, apparent, coma, minutes, picard, imagines, named, kamin, living, doomed, planet, long, time, ago	scientest	87.93548	161	25	1	enterprise, encounters, mysterious, probe, seems, attack, picard, knocking, unconscious, however, lays, bridge, apparent, coma, minutes, picard, imagines, named, kamin, living, doomed, planet, long, time, ago	scientest	94.78332	163	25	1	enterprise, encounters, mysterious, probe, seems, attack, picard, knocking, unconscious, however, lays, bridge, apparent, coma, minutes, picard, imagines, named, kamin, living, doomed, planet, long, time, ago	scientest	95.178163	120	26	0	enterprise, encounters, mysterious, probe, seems, attack, picard, knocking, unconscious, however, lays, bridge, apparent, coma, minutes, picard, imagines, scientest, named, kamin, living, doomed, planet, long, time, ago		95.08055399999999	107	26	0	enterprise, encounters, mysterious, probe, seems, attack, picard, knocking, unconscious, however, lays, bridge, apparent, coma, minutes, picard, imagines, scientest, named, kamin, living, doomed, planet, long, time, ago		91.097534	84	25	1	enterprise, encounters, mysterious, probe, seems, attack, picard, knocking, unconscious, however, lays, bridge, apparent, coma, minutes, picard, imagines, scientest, named, living, doomed, planet, long, time, ago	kamin	96.2114	129	26	0	enterprise, encounters, mysterious, probe, seems, attack, picard, knocking, unconscious, however, lays, bridge, apparent, coma, minutes, picard, imagines, scientest, named, kamin, living, doomed, planet, long, time, ago		89.96324	3	57	0	92.96555
124	226	Time's Arrow, Part I	5	26	1992-06-15 0:00:00	TIME'S ARROW, PART I	Time'S Arrow, Part I	 This season-ending cliff-hanger finds the Enterprise called back to Earth because of artifacts discovered in a cavern. Most of the artifacts are from 19th century Earth except for one - the remains of Data's head apparently left there sometime in the past where Data was destroyed. The crew finds traces of Triallic Waves in the cavern and traces them back to Devidia Two where they find yet another cave - this one inhabited by beings who are slightly out of phase with our universe. Data assists Geordi in building a Sub-Space distorter to align the synchronic distortion. As Data uses the distorter, the beings inhabiting the area use a temporal distorter and Data is caught in the waves and sent to Earth in the late 19th century.  	6	35	39	season_NOUN, hanger_NOUN, enterprise_NOUN, back_ADV, earth_NOUN, century_NOUN, earth_NOUN, one_NUM, data_NOUN, head_NOUN, apparently_ADV, past_ADJ, data_NOUN, crew_NOUN, back_ADV, two_NUM, find_VERB, yet_ADV, cave_NOUN, one_NUM, slightly_ADV, phase_VERB, data_NOUN, assists_NOUN, sub_NOUN, space_NOUN, distortion_NOUN, data_NOUN, area_NOUN, use_NOUN, temporal_ADJ, data_NOUN, earth_NOUN, late_ADV, century_NOUN	ending_VERB, cliff_ADJ, finds_NOUN, called_VERB, artifacts_NOUN, discovered_VERB, cavern_ADJ, artifacts_NOUN, th_ADJ, except_ADP, remains_VERB, left_VERB, sometime_ADJ, destroyed_VERB, finds_NOUN, traces_VERB, triallic_ADJ, waves_NOUN, cavern_ADJ, traces_NOUN, devidia_VERB, another_DET, inhabited_ADJ, beings_NOUN, universe_ADJ, geordi_VERB, building_VERB, distorter_NOUN, align_NOUN, synchronic_ADJ, uses_NOUN, distorter_VERB, beings_NOUN, inhabiting_VERB, distorter_NOUN, caught_VERB, waves_NOUN, sent_VERB, th_ADJ	93.85589399999999	5	47	27	season_NOUN, ending_VERB, hanger_NOUN, enterprise_NOUN, back_ADV, earth_NOUN, cavern_ADJ, th_ADJ, century_NOUN, earth_NOUN, one_NUM, remains_VERB, data_NOUN, head_NOUN, apparently_ADV, left_VERB, sometime_ADJ, past_ADJ, data_NOUN, crew_NOUN, cavern_ADJ, back_ADV, two_NUM, find_VERB, yet_ADV, cave_NOUN, one_NUM, slightly_ADV, phase_VERB, universe_ADJ, data_NOUN, building_VERB, sub_NOUN, space_NOUN, align_NOUN, synchronic_ADJ, distortion_NOUN, data_NOUN, area_NOUN, use_NOUN, temporal_ADJ, data_NOUN, sent_VERB, earth_NOUN, late_ADV, th_ADJ, century_NOUN	cliff_ADJ, finds_NOUN, called_VERB, artifacts_NOUN, discovered_VERB, artifacts_NOUN, except_ADP, destroyed_VERB, finds_NOUN, traces_VERB, triallic_ADJ, waves_NOUN, traces_NOUN, devidia_VERB, another_DET, inhabited_ADJ, beings_NOUN, assists_NOUN, geordi_VERB, distorter_NOUN, uses_NOUN, distorter_VERB, beings_NOUN, inhabiting_VERB, distorter_NOUN, caught_VERB, waves_NOUN	94.025505	4	69	5	season, ending, cliff, hanger, finds, enterprise, called, back, earth, artifacts, discovered, cavern, artifacts, th, century, earth, except, one, remains, data, head, apparently, left, sometime, past, data, destroyed, crew, finds, traces, waves, cavern, traces, back, two, find, yet, another, cave, one, inhabited, beings, slightly, phase, universe, data, assists, geordi, building, sub, space, align, synchronic, distortion, data, uses, beings, inhabiting, area, use, temporal, data, caught, waves, sent, earth, late, th, century	triallic, devidia, distorter, distorter, distorter	92.90601000000001	7	68	6	season, ending, cliff, hanger, finds, enterprise, called, back, earth, artifacts, discovered, cavern, artifacts, th, century, earth, except, one, remains, data, head, apparently, left, sometime, past, data, destroyed, crew, finds, traces, waves, cavern, traces, back, two, find, yet, another, cave, one, inhabited, beings, slightly, phase, universe, data, assists, geordi, building, sub, space, align, distortion, data, uses, beings, inhabiting, area, use, temporal, data, caught, waves, sent, earth, late, th, century	triallic, devidia, distorter, synchronic, distorter, distorter	97.70122	11	68	6	season, ending, cliff, hanger, finds, enterprise, called, back, earth, artifacts, discovered, cavern, artifacts, th, century, earth, except, one, remains, data, head, apparently, left, sometime, past, data, destroyed, crew, finds, traces, waves, cavern, traces, back, two, find, yet, another, cave, one, inhabited, beings, slightly, phase, universe, data, assists, geordi, building, sub, space, align, distortion, data, uses, beings, inhabiting, area, use, temporal, data, caught, waves, sent, earth, late, th, century	triallic, devidia, distorter, synchronic, distorter, distorter	97.92366	4	72	2	season, ending, cliff, hanger, finds, enterprise, called, back, earth, artifacts, discovered, cavern, artifacts, th, century, earth, except, one, remains, data, head, apparently, left, sometime, past, data, destroyed, crew, finds, traces, waves, cavern, traces, back, two, find, yet, another, cave, one, inhabited, beings, slightly, phase, universe, data, assists, geordi, building, sub, space, distorter, align, synchronic, distortion, data, uses, distorter, beings, inhabiting, area, use, temporal, distorter, data, caught, waves, sent, earth, late, th, century	triallic, devidia	97.43008	4	71	3	season, ending, cliff, hanger, finds, enterprise, called, back, earth, artifacts, discovered, cavern, artifacts, th, century, earth, except, one, remains, data, head, apparently, left, sometime, past, data, destroyed, crew, finds, traces, waves, cavern, traces, back, two, find, yet, another, cave, one, inhabited, beings, slightly, phase, universe, data, assists, building, sub, space, distorter, align, synchronic, distortion, data, uses, distorter, beings, inhabiting, area, use, temporal, distorter, data, caught, waves, sent, earth, late, th, century	triallic, devidia, geordi	95.08362	3	71	3	season, ending, cliff, hanger, finds, enterprise, called, back, earth, artifacts, discovered, cavern, artifacts, th, century, earth, except, one, remains, data, head, apparently, left, sometime, past, data, destroyed, crew, finds, traces, waves, cavern, traces, back, two, find, yet, another, cave, one, inhabited, beings, slightly, phase, universe, data, assists, building, sub, space, distorter, align, synchronic, distortion, data, uses, distorter, beings, inhabiting, area, use, temporal, distorter, data, caught, waves, sent, earth, late, th, century	triallic, devidia, geordi	97.63677	2	72	2	season, ending, cliff, hanger, finds, enterprise, called, back, earth, artifacts, discovered, cavern, artifacts, th, century, earth, except, one, remains, data, head, apparently, left, sometime, past, data, destroyed, crew, finds, traces, waves, cavern, traces, back, two, find, yet, another, cave, one, inhabited, beings, slightly, phase, universe, data, assists, geordi, building, sub, space, distorter, align, synchronic, distortion, data, uses, distorter, beings, inhabiting, area, use, temporal, distorter, data, caught, waves, sent, earth, late, th, century	triallic, devidia	93.55945	2	153	0	93.75241
